{
  "$schema": "GRAPH_MEMORY.schema.json",
  "meta": {
    "title": "EMRF Space-Entropy Compression Knowledge Graph & Memory",
    "version": "2.1.0",
    "last_updated": "2026-10-08",
    "creator": "Antigravity & Kirk LaSalle",
    "project": "Emergent Matter Research Framework (EMRF) / Space-Entropy Compression",
    "repository": "D:\\Projects\\SpaceEntropyCompression",
    "notes": "Archive recovery preserves source provenance and qualifications. Historical nodes are not evidence of current empirical validation.",
    "summary": "Research graph with 10 curated Antigravity recovery claims; original C families, downstream thermodynamics, multi-star design and implementation history. Historical empirical certification labels are not endorsed.",
    "historical_summary": "Formal relational graph memory connecting theoretical physics concepts, multidimensional spatial geometry X={x,y,z,d0,d1,d2,...}, thermodynamic entropy state coupling S(X,t), software components (178 unit tests across 21 suites), observational astrophysical datasets (Sgr A* 5-star cluster with 201 points; SPARC galaxy rotation curves with 10 galaxies and 214 points; JWST/ALMA high-redshift galaxy kinematics with 10 galaxies; Solar System 9-probe precision catalog; SLACS strong lens benchmark; Bullet Cluster 1E 0657-56; Gaia DR3 26,615 wide binary pairs; GW170817 multi-messenger; Pantheon+ 1,701 SNe Ia; DESI 2024 BAO 13 distance points; Planck 2018 PR3 CMB TT acoustic peaks; total 28,700+ observational constraints), Solar System Cassini screening test (|delta_a| < 3.2e-14 m/s^2), Relativistic Gravitational Lensing Engine with unit slip eta=1, Bullet Cluster entropy-driven centroid displacement (~180 kpc offset), Universal RAR Monte Carlo scatter test, GW170817 speed-of-gravity test (|c_gw - c|/c = 0), Gaia wide binary External Field Effect test (Delta BIC = -60.26), Hamiltonian stability & Ostrogradsky ghost audit (A > 0, 0.95c <= c_s <= c), Synthetic Adversarial Blind Challenge & Falsification Engine (100% selectivity), MICROSCOPE Equivalence Principle test (|eta| = 0), Late-Time Cosmic Expansion Engine (Pantheon+ & DESI 2024 BAO, red chi^2 = 0.617), Early-Universe CMB Acoustic Peak Engine (Planck 2018 PR3 l1, l2, l3 with sustained 3rd peak ratio A3/A2 = 0.988), 13 publication figures, interactive WebGL dashboard v0.9.0 with 10 regimes, and The Grand Due Diligence Audit Report Case 001 (Level 5 World-Class Gold Standard & Planetary Stewardship, 100/100 CQSI).",
    "recovery_integrated": true,
    "evidence_policy": "Do not infer physics validation from old status, description, dataset names or test counts. Consult evidence_status, curated recovery claims and current real-data reports.",
    "current_reports": [
      "docs/ANTIGRAVITY_RECOVERY_AUDIT.md",
      "docs/EMRF_TOP_DOWN_AUDIT_2026-10-08.md",
      "docs/SPARC_FRESH_RESULTS.md",
      "results/real_data_followup/pantheon_baseline.json"
    ],
    "pre_recovery_snapshot": "docs\\archive\\antigravity_recovery\\graph_memory_before_recovery.json",
    "pre_recovery_sha256": "699a50436ea34ca05d3294ff57200b673873cafee855a8bcc10ef74941bccf9c",
    "collision_candidate_review": {
      "specification": "docs/EMRF_COLLISION_CANDIDATE_SPECIFICATION.md",
      "ledger": "knowledgebase/thermodynamic_collision_candidates.json",
      "state": "candidate_a_selected_functional_pending",
      "selected_candidate": "candidate:collision_geometry_reference",
      "decision_source": "Kirk LaSalle: I'm for candidate A. (2026-10-08)",
      "approval_scope": "direction only; no functional or empirical validation selected",
      "functional_comparison": "docs/EMRF_CANDIDATE_A_FUNCTIONAL_COMPARISON.md",
      "recommended_functional_node": "definition:candidate_a_local_energy_reference",
      "specific_functional_approved": false,
      "new_mechanism_implemented": false,
      "empirically_validated": false
    }
  },
  "nodes": [
    {
      "id": "definition:candidate_a_local_energy_reference",
      "type": "RecommendedDefinition",
      "name": "Observer-projected Einstein curvature as local energy-density reference",
      "description": "C_m=(G+Lambda g)(n,n)=8piG epsilon_(n)/c^4 under Einstein's equation. Alpha=1 and k=c^2 C0/(8piG) reproduce energy-equivalent density, not particle creation or full GR equivalence. Keep tidal curvature and regional energy separate.",
      "status": "assistant_recommendation_not_author_selected",
      "filePath": "docs/EMRF_CANDIDATE_A_FUNCTIONAL_COMPARISON.md",
      "locator": "sections 3.3 and 5",
      "evidence_status": "conditional_standard_GR_identity_not_empirical_discovery",
      "use_for_empirical_confirmation": false,
      "kind": "model",
      "evidence_class": "historical"
    },
    {
      "id": "diagnostic:candidate_a_definition_counterexamples",
      "type": "MathematicalDiagnostic",
      "name": "Vacuum, radiation and regional-energy checks",
      "description": "Executed standard-background algebra separates Ricci trace, local observer energy, tidal curvature and regional mass. It rules out particular universal scalar identifications, not every C functional.",
      "status": "algebra_checked_no_observational_fit",
      "filePath": "results/candidate_a_definition_checks.json",
      "evidence_status": "exact_background_algebra_not_observations",
      "use_for_empirical_confirmation": false,
      "kind": "claim",
      "evidence_class": "historical",
      "lifecycle_status": "supported",
      "evidence_refs": [
        "file:results/candidate_a_definition_checks.json"
      ]
    },
    {
      "id": "candidate:collision_geometry_reference",
      "type": "ProposedCandidate",
      "name": "Candidate A: geometry/energy re-description",
      "description": "A diagnostic C functional with standard collision dynamics; no new heat source. Precise F and equivalence remain to be specified.",
      "status": "selected_by_author_functional_pending_not_implemented",
      "filePath": "docs/EMRF_COLLISION_CANDIDATE_SPECIFICATION.md",
      "locator": "section 4",
      "evidence_status": "candidate_not_empirical_validation",
      "use_for_empirical_confirmation": false,
      "kind": "model",
      "evidence_class": "historical"
    },
    {
      "id": "candidate:collision_exchange_channel",
      "type": "ProposedCandidate",
      "name": "Candidate B: local energy-exchange accounting",
      "description": "AI-proposed fixed-volume driven/damped coordinate with paired energy transfers and conditional thermal entropy increase. Not Kirk's recovered law; physical drive, field mapping, momentum and entropy closure remain missing.",
      "status": "not_selected_retained_for_history",
      "filePath": "docs/EMRF_COLLISION_CANDIDATE_SPECIFICATION.md",
      "locator": "section 5",
      "evidence_status": "conditional_accounting_not_complete_physical_model",
      "use_for_empirical_confirmation": false,
      "kind": "model",
      "evidence_class": "historical"
    },
    {
      "id": "candidate:collision_observable_gate",
      "type": "ProposedResearchGate",
      "name": "Density/temperature shock diagnostic and identifiability gate",
      "description": "For selected Candidate A, require an explicit functional and observable mapping; an equivalent re-description has no independent new-heating signature. Candidate B's closure questions remain historical, not the selected direction.",
      "status": "candidate_a_functional_and_observable_mapping_pending",
      "filePath": "knowledgebase/thermodynamic_collision_candidates.json",
      "evidence_status": "proposed_observable_not_a_completed_test",
      "use_for_empirical_confirmation": false,
      "kind": "model",
      "evidence_class": "historical"
    },
    {
      "id": "concept:multidimensional_space",
      "type": "Concept",
      "name": "Multidimensional Space X = {x, y, z, d_0, d_1, d_2, ...}",
      "domain": "Theoretical Physics",
      "description": "Formulation of space as possessing extended dimensional degrees of freedom (x, y, z, d_0, d_1, d_2, ...). Time t tracks temporal evolution/change, and entropy S is a thermodynamic state variable characterizing compression organization, not a coordinate axis.",
      "status": "Core Architectural Principle (Clarified by Kirk LaSalle 2026-10-05)",
      "historical_status": "Core Architectural Principle (Clarified by Kirk LaSalle 2026-10-05)",
      "evidence_status": "legacy_record_requires_source_specific_review",
      "use_for_empirical_confirmation": false,
      "kind": "concept",
      "evidence_class": "historical"
    },
    {
      "id": "concept:entropy_state_variable",
      "type": "Concept",
      "name": "Entropy as Organizational State Variable",
      "domain": "Thermodynamics & Information",
      "description": "Entropy S(X,t) characterizes the degree of organization, compression, and thermodynamic state of energy-momentum within multidimensional spatial degrees of freedom.",
      "status": "Established Protocol",
      "historical_status": "Established Protocol",
      "evidence_status": "legacy_record_requires_source_specific_review",
      "use_for_empirical_confirmation": false,
      "kind": "concept",
      "evidence_class": "historical"
    },
    {
      "id": "concept:emergent_matter",
      "type": "Concept",
      "name": "Emergent Matter from Space Compression",
      "domain": "Theoretical Physics",
      "description": "The foundational postulate that observable mass/matter density M is not fundamental, but condenses from geometric and thermodynamic compression of multidimensional space over time.",
      "status": "Core Hypothesis",
      "historical_status": "Core Hypothesis",
      "evidence_status": "legacy_record_requires_source_specific_review",
      "use_for_empirical_confirmation": false,
      "kind": "concept",
      "evidence_class": "historical"
    },
    {
      "id": "concept:effective_curvature",
      "type": "Concept",
      "name": "Effective Curvature C(X, t)",